{
  "$schema": "https://json-schema.org/draft/2020-12/schema",
  "$id": "https://github.com/99x-Projects/compliance-automation/contracts/schemas/compliance-event.v2.schema.json",
  "title": "Compliance event for AI Hub (v2)",
  "description": "Body POSTed to AI Hub activity-scoped ingest (Hub event shape, blank mapping). One item per control assessed; all items of one execution share correlationId. Summary only: 'dimensions' holds flat, queryable facts, and obligations, actions and sources carry what dashboards show. Evidence, report sections and the full Markdown report are kept as the detailed report — an AI Hub artifact by default, or a repository file — linked by 'detail'. Each event must stay under 16 KB. Changes from v1: dimensions.runEvents is required, and detail may name an AI Hub artifact.",
  "type": "array",
  "minItems": 1,
  "maxItems": 200,
  "items": {
    "type": "object",
    "additionalProperties": false,
    "required": ["correlationId", "eventId", "actors", "dimensions", "summary", "obligations", "actions", "sources", "notAssessed", "detail"],
    "properties": {
      "correlationId": {
        "description": "The audit execution id. Groups every control from one execution.",
        "type": "string", "pattern": "^[A-Za-z0-9._:-]+$", "maxLength": 120
      },
      "eventId": {
        "description": "Idempotency key: <standardKey>:<control>:<repository>:<executionId>. AI Hub skips duplicates per team.",
        "type": "string", "minLength": 1, "maxLength": 200
      },
      "actors": {
        "type": "array", "minItems": 1, "maxItems": 5,
        "items": { "type": "string", "minLength": 1, "maxLength": 200 }
      },
      "dimensions": {
        "type": "object",
        "additionalProperties": false,
        "required": ["schema", "standard", "standardKey", "control", "controlTitle", "controlGroup", "repository", "commit", "baselineRef", "runAt", "runEvents", "executionId", "pluginVersion", "overall", "conform", "partial", "gap", "na", "p0Actions", "sourcesOk", "sourcesTotal", "sourcesMode", "notAssessedCount"],
        "properties": {
          "schema": { "const": "compliance.v2" },
          "standard": { "type": "string", "minLength": 1, "maxLength": 100 },
          "standardKey": { "$ref": "compliance-common.v1.schema.json#/$defs/standardKey" },
          "control": { "$ref": "compliance-common.v1.schema.json#/$defs/controlId" },
          "controlTitle": { "type": "string", "minLength": 1, "maxLength": 200 },
          "controlGroup": { "$ref": "compliance-common.v1.schema.json#/$defs/controlId" },
          "repository": { "$ref": "compliance-common.v1.schema.json#/$defs/repository" },
          "commit": { "$ref": "compliance-common.v1.schema.json#/$defs/commit" },
          "baselineRef": { "type": "string", "minLength": 1, "maxLength": 200 },
          "runAt": { "type": "string", "format": "date-time" },
          "runEvents": {
            "description": "How many events this execution sends in total (one per control assessed). AI Hub treats the run as incomplete until that many have arrived, so a half-delivered run is never shown as the latest one.",
            "type": "integer", "minimum": 1, "maximum": 200
          },
          "executionId": { "type": "string", "pattern": "^[A-Za-z0-9._:-]+$", "maxLength": 120 },
          "pluginVersion": { "type": "string", "minLength": 1, "maxLength": 120 },
          "overall": { "$ref": "compliance-common.v1.schema.json#/$defs/verdict" },
          "conform": { "type": "integer", "minimum": 0 },
          "partial": { "type": "integer", "minimum": 0 },
          "gap": { "type": "integer", "minimum": 0 },
          "na": { "type": "integer", "minimum": 0 },
          "p0Actions": {
            "description": "Number of P0 actions — separates 'Partial, nearly there' from 'Partial, far off'.",
            "type": "integer", "minimum": 0
          },
          "sourcesOk": { "type": "integer", "minimum": 0 },
          "sourcesTotal": { "type": "integer", "minimum": 1 },
          "sourcesMode": { "enum": ["declared", "implicit-git-repo"] },
          "notAssessedCount": { "type": "integer", "minimum": 0 },
          "tokens": { "$ref": "compliance-common.v1.schema.json#/$defs/metricValue" },
          "cacheReadTokens": { "$ref": "compliance-common.v1.schema.json#/$defs/metricValue" },
          "costUsd": { "$ref": "compliance-common.v1.schema.json#/$defs/metricValue" },
          "model": { "type": "string", "minLength": 1, "maxLength": 120 }
        }
      },
      "summary": { "type": "string", "minLength": 1, "maxLength": 2000 },
      "obligations": {
        "type": "array", "minItems": 1, "maxItems": 200,
        "items": { "$ref": "compliance-common.v1.schema.json#/$defs/obligationSummary" }
      },
      "actions": {
        "type": "array", "maxItems": 100,
        "items": { "$ref": "compliance-common.v1.schema.json#/$defs/action" }
      },
      "sources": {
        "type": "array", "minItems": 1, "maxItems": 50,
        "items": { "$ref": "compliance-common.v1.schema.json#/$defs/source" }
      },
      "notAssessed": {
        "type": "array", "maxItems": 50,
        "items": { "type": "string", "minLength": 1, "maxLength": 300 }
      },
      "detail": { "$ref": "#/$defs/detail" }
    }
  },
  "$defs": {
    "detail": {
      "description": "Where the detailed report for this control is kept; the event is the summary and links here. stored = kept as an AI Hub artifact (provider aihub, linked by artifact id) or committed to a repository branch (provider github, linked by commit permalink), with the SHA-256 of the stored bytes either way; issue-comment = a repository commit failed and the report was posted to the triggering issue; failed / disabled = no detail is available.",
      "type": "object",
      "additionalProperties": false,
      "required": ["status"],
      "properties": {
        "status": { "enum": ["stored", "issue-comment", "failed", "disabled"] },
        "provider": { "enum": ["aihub", "github"] },
        "artifactId": { "description": "AI Hub artifact id, as returned by the upload.", "type": "string", "pattern": "^art_[A-Za-z0-9]{6,32}$" },
        "byteSize": { "type": "integer", "minimum": 1 },
        "repository": { "$ref": "compliance-common.v1.schema.json#/$defs/repository" },
        "branch": { "type": "string", "pattern": "^[A-Za-z0-9._/-]+$", "maxLength": 100 },
        "commit": { "description": "Full commit SHA, so the link never moves.", "type": "string", "pattern": "^[0-9a-f]{40}$" },
        "path": { "type": "string", "pattern": "^[A-Za-z0-9._/-]+$", "maxLength": 300 },
        "url": { "type": "string", "format": "uri", "pattern": "^https://", "maxLength": 600 },
        "sha256": { "description": "SHA-256 of the stored report's bytes.", "type": "string", "pattern": "^[0-9a-f]{64}$" },
        "reason": { "type": "string", "minLength": 1, "maxLength": 300 }
      },
      "allOf": [
        { "if": { "properties": { "status": { "const": "stored" } } }, "then": { "required": ["provider", "sha256"] } },
        {
          "if": { "properties": { "status": { "const": "stored" }, "provider": { "const": "aihub" } }, "required": ["provider"] },
          "then": { "required": ["artifactId"], "properties": { "repository": false, "branch": false, "commit": false, "path": false, "url": false } }
        },
        {
          "if": { "properties": { "status": { "const": "stored" }, "provider": { "const": "github" } }, "required": ["provider"] },
          "then": { "required": ["repository", "branch", "commit", "path", "url"], "properties": { "artifactId": false, "byteSize": false } }
        },
        { "if": { "properties": { "status": { "const": "issue-comment" } } }, "then": { "required": ["url", "reason"] } },
        { "if": { "properties": { "status": { "enum": ["failed", "disabled"] } } }, "then": { "required": ["reason"] } }
      ]
    }
  }
}
