[
  {
    "correlationId": "exec-sample-27001",
    "eventId": "iso-27001-2022:A.5.15:example-org/sample-service:exec-sample-27001",
    "actors": [
      "ISO Audit Agent"
    ],
    "dimensions": {
      "schema": "compliance.v2",
      "standard": "ISO/IEC 27001:2022",
      "standardKey": "iso-27001-2022",
      "control": "A.5.15",
      "controlTitle": "Access control",
      "controlGroup": "A.5",
      "repository": "example-org/sample-service",
      "commit": "0a1b2c3",
      "baselineRef": "main",
      "runAt": "2026-09-20T09:30:00Z",
      "runEvents": 2,
      "executionId": "exec-sample-27001",
      "pluginVersion": "isms@0.0.0-sample",
      "overall": "Partial",
      "conform": 1,
      "partial": 1,
      "gap": 1,
      "na": 0,
      "p0Actions": 1,
      "sourcesOk": 1,
      "sourcesTotal": 2,
      "sourcesMode": "declared",
      "notAssessedCount": 1,
      "tokens": "{{metrics.tokens.total}}",
      "costUsd": "{{metrics.cost-usd}}"
    },
    "summary": "Synthetic sample for contract tests. Access rules exist for the deployment pipeline, but no access policy or periodic review was found.",
    "obligations": [
      {
        "n": 1,
        "title": "Access rules defined for systems in scope",
        "core": true,
        "verdict": "Partial",
        "originalVerdict": "Partially implemented",
        "gap": "Rules exist for CI only; no written access policy.",
        "evidenceCount": 1
      },
      {
        "n": 2,
        "title": "Access rights reviewed periodically",
        "core": true,
        "verdict": "Gap",
        "originalVerdict": "Not implemented",
        "gap": "No review records found in declared sources.",
        "evidenceCount": 0
      },
      {
        "n": 3,
        "title": "Privileged access restricted",
        "core": true,
        "verdict": "Conform",
        "originalVerdict": "Implemented",
        "gap": "",
        "evidenceCount": 1
      }
    ],
    "actions": [
      {
        "priority": "P0",
        "text": "Schedule and record a quarterly access review.",
        "closes": [
          2
        ],
        "artifact": "isms/access-review.md"
      },
      {
        "priority": "P1",
        "text": "Write an access policy covering all systems in scope.",
        "closes": [
          1
        ]
      }
    ],
    "sources": [
      {
        "id": "codebase",
        "provider": "git-repo",
        "roles": [
          "process-control"
        ],
        "verdict": "ok",
        "artifacts": 12
      },
      {
        "id": "isms-wiki",
        "provider": "confluence",
        "roles": [
          "documented-information"
        ],
        "verdict": "UNAVAILABLE",
        "artifacts": 0,
        "note": "ATLASSIAN-API-TOKEN missing"
      }
    ],
    "notAssessed": [
      "Identity provider configuration"
    ],
    "detail": {
      "status": "stored",
      "provider": "aihub",
      "artifactId": "art_2ce527f4d2",
      "byteSize": 97,
      "sha256": "2ce527f4d22aedef9d67532d3fc7057c5822b3c74ec7237d3970bd1d715f16c2"
    }
  },
  {
    "correlationId": "exec-sample-27001",
    "eventId": "iso-27001-2022:A.8.13:example-org/sample-service:exec-sample-27001",
    "actors": [
      "ISO Audit Agent"
    ],
    "dimensions": {
      "schema": "compliance.v2",
      "standard": "ISO/IEC 27001:2022",
      "standardKey": "iso-27001-2022",
      "control": "A.8.13",
      "controlTitle": "Information backup",
      "controlGroup": "A.8",
      "repository": "example-org/sample-service",
      "commit": "0a1b2c3",
      "baselineRef": "main",
      "runAt": "2026-09-20T09:30:00Z",
      "runEvents": 2,
      "executionId": "exec-sample-27001",
      "pluginVersion": "isms@0.0.0-sample",
      "overall": "N/A",
      "conform": 0,
      "partial": 0,
      "gap": 0,
      "na": 1,
      "p0Actions": 0,
      "sourcesOk": 1,
      "sourcesTotal": 2,
      "sourcesMode": "declared",
      "notAssessedCount": 1
    },
    "summary": "Synthetic sample for contract tests. The service stores no persistent data of its own.",
    "obligations": [
      {
        "n": 1,
        "title": "Backups taken and tested",
        "core": true,
        "verdict": "N/A",
        "originalVerdict": "Not applicable",
        "gap": "",
        "evidenceCount": 0
      }
    ],
    "actions": [],
    "sources": [
      {
        "id": "codebase",
        "provider": "git-repo",
        "roles": [
          "process-control"
        ],
        "verdict": "ok",
        "artifacts": 12
      },
      {
        "id": "isms-wiki",
        "provider": "confluence",
        "roles": [
          "documented-information"
        ],
        "verdict": "UNAVAILABLE",
        "artifacts": 0,
        "note": "ATLASSIAN-API-TOKEN missing"
      }
    ],
    "notAssessed": [
      "Identity provider configuration"
    ],
    "detail": {
      "status": "stored",
      "provider": "aihub",
      "artifactId": "art_a5a8f64c4d",
      "byteSize": 95,
      "sha256": "a5a8f64c4d88ef3235e8cf58c68c600dd50be5a599b0aada31ea8fae36dba797"
    }
  }
]
